{
  "automation_surfaces": {
    "mcp_stdio": "deferred",
    "one_shot_json": "active",
    "tui_automation": "unsupported"
  },
  "binary_version": "0.6.0",
  "build": {
    "source_commit": "0000000000000000000000000000000000000001",
    "source_tree": "0000000000000000000000000000000000000002",
    "dirty": false,
    "toolchain": "rustc-qualified-fixture",
    "distribution_channel": "development",
    "target": "x86_64-unknown-linux-gnu",
    "features": [],
    "build_input_digest_sha256": "0000000000000000000000000000000000000000000000000000000000000003"
  },
  "capabilities": [
    {
      "contract_version": "v1",
      "id": "agent-self-description",
      "status": "active",
      "summary": "Offline manifest, guide, schemas, and doctor are embedded."
    },
    {
      "contract_version": "v1",
      "id": "grocery",
      "status": "active",
      "summary": "Human Grocery workflows are active; agent access follows per-command audience."
    },
    {
      "contract_version": "v1",
      "id": "menu-watch",
      "status": "active",
      "summary": "Human Menu Watch management is active; agent access follows per-command audience."
    },
    {
      "contract_version": null,
      "id": "agent-mcp",
      "status": "deferred",
      "summary": "The local typed MCP server is not active in this phase."
    },
    {
      "contract_version": null,
      "id": "health",
      "status": "deferred",
      "summary": "Health is outside the supported release contract."
    },
    {
      "contract_version": null,
      "id": "native-voice",
      "status": "deferred",
      "summary": "Native voice is not enabled in the default artifact."
    },
    {
      "contract_version": null,
      "id": "windows-distribution",
      "status": "deferred",
      "summary": "Windows source CI is active; public Windows distribution is deferred."
    }
  ],
  "commands": [
    {
      "audience": "agent_safe",
      "authorization_upgrade_command": null,
      "browser_handoff": "none",
      "credential_side_effect_possible": false,
      "error_schema_id": "https://hey.food/schemas/v1/heyfood-cli-error.schema.json",
      "error_schema_sha256": "18e5bc9fdafccd06e5a0e5bd185ba213488ef5f11fbfed51f06646992254cc8e",
      "examples": [
        "heyfood agent"
      ],
      "exit_behavior": "one_json_value",
      "human_confirmation": "none",
      "input_channel": "none",
      "interactivity": "none",
      "network": false,
      "operation_class": "local_read",
      "output_family": "heyfood_agent_manifest_v1",
      "output_schema_id": "https://hey.food/schemas/v1/heyfood-agent-manifest.schema.json",
      "output_schema_sha256": "2d078de78da2606f20c2a1a48188565efe28dcaec6c796f5cea8c11a12e38d80",
      "path": "agent",
      "product_state_mutation": false,
      "purpose": "Describe the exact installed agent contract.",
      "reconciliation_command": null,
      "required_scopes": [],
      "retry_class": "not_applicable",
      "status": "active"
    },
    {
      "audience": "agent_safe",
      "authorization_upgrade_command": null,
      "browser_handoff": "none",
      "credential_side_effect_possible": false,
      "error_schema_id": "https://hey.food/schemas/v1/heyfood-cli-error.schema.json",
      "error_schema_sha256": "18e5bc9fdafccd06e5a0e5bd185ba213488ef5f11fbfed51f06646992254cc8e",
      "examples": [
        "heyfood agent describe"
      ],
      "exit_behavior": "one_json_value",
      "human_confirmation": "none",
      "input_channel": "none",
      "interactivity": "none",
      "network": false,
      "operation_class": "local_read",
      "output_family": "heyfood_agent_manifest_v1",
      "output_schema_id": "https://hey.food/schemas/v1/heyfood-agent-manifest.schema.json",
      "output_schema_sha256": "2d078de78da2606f20c2a1a48188565efe28dcaec6c796f5cea8c11a12e38d80",
      "path": "agent describe",
      "product_state_mutation": false,
      "purpose": "Describe the exact installed agent contract.",
      "reconciliation_command": null,
      "required_scopes": [],
      "retry_class": "not_applicable",
      "status": "active"
    },
    {
      "audience": "agent_safe",
      "authorization_upgrade_command": null,
      "browser_handoff": "none",
      "credential_side_effect_possible": false,
      "error_schema_id": "https://hey.food/schemas/v1/heyfood-cli-error.schema.json",
      "error_schema_sha256": "18e5bc9fdafccd06e5a0e5bd185ba213488ef5f11fbfed51f06646992254cc8e",
      "examples": [
        "heyfood agent guide --format markdown",
        "heyfood --json agent guide --format markdown --safety"
      ],
      "exit_behavior": "raw_markdown_or_one_json_value",
      "human_confirmation": "none",
      "input_channel": "arguments",
      "interactivity": "none",
      "network": false,
      "operation_class": "local_read",
      "output_family": "markdown_or_agent_guide_v1",
      "output_schema_id": "https://hey.food/schemas/v1/heyfood-agent-guide.schema.json",
      "output_schema_sha256": "d6b3e59993bd0bd08b2f0ee5d460780aced65fb64a93326cc6a3e936985391ef",
      "path": "agent guide",
      "product_state_mutation": false,
      "purpose": "Print the embedded agent integration or safety guide.",
      "reconciliation_command": null,
      "required_scopes": [],
      "retry_class": "not_applicable",
      "status": "active"
    },
    {
      "audience": "agent_safe",
      "authorization_upgrade_command": null,
      "browser_handoff": "none",
      "credential_side_effect_possible": false,
      "error_schema_id": "https://hey.food/schemas/v1/heyfood-cli-error.schema.json",
      "error_schema_sha256": "18e5bc9fdafccd06e5a0e5bd185ba213488ef5f11fbfed51f06646992254cc8e",
      "examples": [
        "heyfood agent schema --list",
        "heyfood agent schema manifest"
      ],
      "exit_behavior": "one_json_value",
      "human_confirmation": "none",
      "input_channel": "arguments",
      "interactivity": "none",
      "network": false,
      "operation_class": "local_read",
      "output_family": "json_schema_2020_12",
      "output_schema_id": "https://hey.food/schemas/v1/heyfood-agent-schema-result.schema.json",
      "output_schema_sha256": "fa0388782aa5aee14ba5822788cf34dffd2a70a31b616d614ab710a283f1a2e7",
      "path": "agent schema",
      "product_state_mutation": false,
      "purpose": "Print one embedded agent JSON Schema.",
      "reconciliation_command": null,
      "required_scopes": [],
      "retry_class": "not_applicable",
      "status": "active"
    },
    {
      "audience": "agent_safe",
      "authorization_upgrade_command": null,
      "browser_handoff": "none",
      "credential_side_effect_possible": false,
      "error_schema_id": "https://hey.food/schemas/v1/heyfood-cli-error.schema.json",
      "error_schema_sha256": "18e5bc9fdafccd06e5a0e5bd185ba213488ef5f11fbfed51f06646992254cc8e",
      "examples": [
        "heyfood agent doctor"
      ],
      "exit_behavior": "one_json_value",
      "human_confirmation": "none",
      "input_channel": "none",
      "interactivity": "none",
      "network": false,
      "operation_class": "local_read",
      "output_family": "agent_doctor_v1",
      "output_schema_id": "https://hey.food/schemas/v1/heyfood-agent-doctor.schema.json",
      "output_schema_sha256": "b1278370a479de364a3c2242c5b0c98a512ec93811e3c13658679ec591c1d2d5",
      "path": "agent doctor",
      "product_state_mutation": false,
      "purpose": "Inspect the local integration without credentials or network.",
      "reconciliation_command": null,
      "required_scopes": [],
      "retry_class": "not_applicable",
      "status": "active"
    },
    {
      "audience": "agent_unsupported",
      "authorization_upgrade_command": null,
      "browser_handoff": "none",
      "credential_side_effect_possible": true,
      "error_schema_id": "https://hey.food/schemas/v1/heyfood-cli-error.schema.json",
      "error_schema_sha256": "18e5bc9fdafccd06e5a0e5bd185ba213488ef5f11fbfed51f06646992254cc8e",
      "examples": [],
      "exit_behavior": "one_json_value",
      "human_confirmation": "none",
      "input_channel": "arguments_or_utf8_stdin",
      "interactivity": "none",
      "network": true,
      "operation_class": "remote_read",
      "output_family": "agent_turn_result_v1",
      "output_schema_id": null,
      "output_schema_sha256": null,
      "path": "ask",
      "product_state_mutation": false,
      "purpose": "Ask the hosted conversational service.",
      "reconciliation_command": null,
      "required_scopes": [],
      "retry_class": "reconcile_before_retry",
      "status": "active"
    },
    {
      "audience": "agent_unsupported",
      "authorization_upgrade_command": null,
      "browser_handoff": "none",
      "credential_side_effect_possible": true,
      "error_schema_id": "https://hey.food/schemas/v1/heyfood-cli-error.schema.json",
      "error_schema_sha256": "18e5bc9fdafccd06e5a0e5bd185ba213488ef5f11fbfed51f06646992254cc8e",
      "examples": [],
      "exit_behavior": "one_json_value",
      "human_confirmation": "none",
      "input_channel": "arguments_or_utf8_stdin",
      "interactivity": "none",
      "network": true,
      "operation_class": "remote_read",
      "output_family": "agent_turn_result_v1",
      "output_schema_id": null,
      "output_schema_sha256": null,
      "path": "reply",
      "product_state_mutation": false,
      "purpose": "Continue one hosted conversation.",
      "reconciliation_command": null,
      "required_scopes": [],
      "retry_class": "reconcile_before_retry",
      "status": "active"
    },
    {
      "audience": "human_terminal_only",
      "authorization_upgrade_command": null,
      "browser_handoff": "none",
      "credential_side_effect_possible": true,
      "error_schema_id": "https://hey.food/schemas/v1/heyfood-cli-error.schema.json",
      "error_schema_sha256": "18e5bc9fdafccd06e5a0e5bd185ba213488ef5f11fbfed51f06646992254cc8e",
      "examples": [],